{
  "schemaVersion": 2,
  "tripId": "city-demo",
  "overview": {
    "title": "City Demo",
    "summary": "同一套 Standard renderer 嘅第二個 Trip。",
    "note": "Live Cam / Driving Mode 關閉。",
    "highlights": [
      {
        "title": "✅ Generic",
        "text": "只靠 trips/city-demo data。"
      }
    ]
  },
  "transport": {
    "title": "🚆 交通",
    "cards": [
      {
        "title": "公共交通",
        "lines": [
          "Demo data"
        ]
      }
    ]
  },
  "customSections": [
    {
      "id": "demo-cards",
      "title": "Cards Demo",
      "type": "cards",
      "cards": [
        {
          "title": "Card",
          "lines": [
            "Standard cards"
          ]
        }
      ]
    },
    {
      "id": "demo-list",
      "title": "List Demo",
      "type": "list",
      "items": [
        "Standard list"
      ]
    },
    {
      "id": "demo-notice",
      "title": "Notice Demo",
      "type": "notice",
      "text": "Standard notice"
    },
    {
      "id": "demo-links",
      "title": "Links Demo",
      "type": "links",
      "links": [
        {
          "label": "Standard link",
          "href": "https://example.com/"
        }
      ]
    }
  ]
}
